url,text,tags
https://www.youtube.com/watch?v=Mdy6A-OUxz8&pp=ygUEbWF0aA%3D%3D," Hello everyone, welcome to all of you. Today again I have brought a lot of reasoning questions for you, which are important for you and your exam. So watch the entire video till the end to learn something new. And if you like the video, then like the video and leave a nice comment. And share this video as much as possible so that everyone can learn something new. So let's start today's video.","['Educational', 'math']"
https://www.youtube.com/watch?v=10ObsB229hk&pp=ygUEbWF0aA%3D%3D," Here's a scenario, you have bought something, stock or crypto, but it has dropped, and then dropped some more, and you have decided, I'm gonna hold and hope that the price goes back up so I can get to break even or make a little bit of money. But I want you to consider this math, because the math, while very easy, it hides in plain sight, and I can understand why people sort of just make a false jump in mathematical logic to the wrong conclusion, because at the surface you would think, okay, that's what it is.","['Educational', 'math']"
https://www.youtube.com/watch?v=rx4tSn6vbA8&pp=ygUEbWF0aA%3D%3D," I got a lot of comments telling me to turn off Sharpshooter at 40% shots. This is wrong. If I turn off Sharpshooter here, I do less damage on average. We also call it DPR, Damage Per Round. Don't believe me? Well, let's do some math then. This math is really valuable to know for any Sharpshooter or Great Weapon Master build out there for Baldur's Gate. I highly recommend knowing this.","['Educational', 'math']"
https://www.youtube.com/watch?v=17l8vGy6X7A&pp=ygUEbWF0aA%3D%3D, Multiplication table quiz for kids 11 to 20.,"['Educational', 'math']"
https://www.youtube.com/watch?v=Kp2bYWRQylk&pp=ygUEbWF0aA%3D%3D," Mathematical equations can be quite intimidating if you don't know how to read them. But they don't need to be. It's possible to learn how to make sense of them even if you don't know much algebra. So if, when you see an equation, it looks like a strange alien language, this video is for you.","['Educational', 'math']"
https://www.youtube.com/watch?v=YOlDklc49mY&pp=ygUEbWF0aA%3D%3D," What should we do while sitting? We have to do some work. Come, let me teach you calculation boosters in the name of Dear Sir. Friends, I welcome you all to my channel Dear Sir. Today's video is a very general video. Today, I will not talk about any big formulas. Today, I will not talk about any concept. Today, I will not talk about any chapter. Today, I will give you very small, very basic, small, small, small, small, small, small, small, small, small, small, small, small, small, small, small, small, small, small, small, small, small, small, small, small, small, small, small, small, small, small, small, small, small, small, small, small, small, small, small, small, small, small, small, small, small, small, small, small, small, small, small, small, small, small, small, small, small, small, small, small, small, small, small, small, small","['Educational', 'math']"
https://www.youtube.com/watch?v=SE700Lc_9pE&pp=ygUEbWF0aA%3D%3D, welcome everyone to my channel today we have a challenge on the board it's matoliped challenge matoliped question so how do we solve this but before then if you're new to this channel kindly subscribe and when you subscribe turn on the bell notification button okay so let's take a look at this question for the day the question says 3 to the power of m minus 2 to the power of m equal to 65 what there will be the possible value of,"['Educational', 'math']"
https://www.youtube.com/watch?v=TRcmWU3n_lQ&pp=ygUEbWF0aA%3D%3D," Which is larger, 50 to the power of 50, or 49 to the power of 51? The question is wonderful. However, the numbers are stupid. Look, the left hand side, 50, the base, 50, exponent as well. The right hand side, the base is 49, and exponent is 51.","['Educational', 'math']"
https://www.youtube.com/watch?v=uONIJ5TQ2DA&pp=ygUEbWF0aA%3D%3D," Move and add, add and move Learning addition is really cool Add and move, move and add","['Educational', 'math']"
https://www.youtube.com/watch?v=40c1avDEhr4&pp=ygUEbWF0aA%3D%3D," Hello friends, welcome to study stage. Today we will learn how to solve the equation. Watch the video till the end because you will get a question at the end. We will solve the question and answer it in the comment box. The first question is 3x square minus 10x plus 8. Let's solve the equation. First write the question. The question is 3x square minus 10x plus 8.","['Educational', 'math']"
https://www.youtube.com/watch?v=9S3FRENg43I&pp=ygUEbWF0aA%3D%3D, Hmm.,"['Educational', 'math']"
https://www.youtube.com/watch?v=ObiqJzfyACM&pp=ygUEbWF0aA%3D%3D," Hey, Vsauce. Michael here. If you rearrange the letters in William Shakespeare, you can spell, here was I, like a psalm. In the King James Bible, in Psalm 46, the 46th word is shake. And the 46th word from the bottom is spear. William Shakespeare was 46 years old when the King James Bible was completed.","['Educational', 'math']"
https://www.youtube.com/watch?v=glZLHLLalv0&pp=ygUEbWF0aA%3D%3D," Within just four years, I went from being a very average student at a bad middle school to becoming the youngest contestant to ever win a medal at the International Physics Olympiad for my country. And a few years later, I landed one of the highest paid internships in Wall Street. And all of this happened because I fundamentally changed the way I think about mathematics.","['Educational', 'math']"
https://www.youtube.com/watch?v=XFDM1ip5HdU&pp=ygUEbWF0aA%3D%3D," Take 1, plus 2, plus 4, plus 8, and continue on and on adding the next power of 2 up to infinity. This might seem crazy, but there's a sense in which this infinite sum equals negative 1. If you're like me, this feels strange or obviously false when you first see it. But I promise you, by the end of this video, you and I will make it make sense.","['Educational', 'math']"
https://www.youtube.com/watch?v=KzfWUEJjG18&pp=ygUEbWF0aA%3D%3D," Hi, I'm Rob. Welcome to Math Antics. In this video, we're gonna learn about how to do math with things that only sometimes happen. They might be likely or unlikely. We're gonna learn about Probability.","['Educational', 'math']"
https://www.youtube.com/watch?v=gJbbXxDoWyA&pp=ygUEbWF0aA%3D%3D, Math riddles are a fun way to train your brain. They combine mind-sharpening math and puzzles that improve analytical thinking. Be very attentive though. Just one slip and you might lose. There are three keys that can open three doors. What is the biggest number of attempts you'll need to figure out the key for each door?,"['Educational', 'math']"
https://www.youtube.com/watch?v=OmJ-4B-mS-Y&pp=ygUEbWF0aA%3D%3D," The mathematics we learn in school doesn't quite do the field of mathematics justice. We only get a glimpse at one corner of it, but mathematics as a whole is a huge and wonderfully diverse subject. My aim with this video is to show you all of that amazing stuff.","['Educational', 'math']"
https://www.youtube.com/watch?v=YOyE3IfEj8w&pp=ygUEbWF0aA%3D%3D," Yo, Mabu, you really the only independent artist putting up numbers right now, bro. They call me the independent variable for a reason, gang. Oh, that's why. I spend eight hours a day in school, and I still put up more numbers than these fleas. Oh, shit. Like, most of y'all rappers are signed to the streets. Only deal that you took was a plea. Mabu, your money, Bali P, shout out my label. That's me. I own 100% of my cuts.","['Educational', 'math']"
https://www.youtube.com/watch?v=bOCHTHkBoAs&pp=ygUEbWF0aA%3D%3D," People often say you don't need to know any math to program a computer, and that's truthy. However, any sufficiently advanced technology is indistinguishable from magic. But magic isn't real. Math explains it all. Developers often avoid learning math because it looks scary, but it actually makes complicated magic like computer graphics and neural networks easier to understand. And not just that, but it unlocks the secrets of the entire physical universe. There's a few abstract math concepts for programmers that you just can't ignore.","['Educational', 'math']"
https://www.youtube.com/watch?v=nmsrfqVcidQ&pp=ygUEbWF0aA%3D%3D," Welcome to Southern Math. Oh, question? No, more of a fact. Math is just math. Give me a couple reasons why you think that. Well, numbers are pretty much the same everywhere. I mean, one plus one is always gonna be two. Go on, with what? There's nothing left to say? Yeah, but I asked for a couple reasons and you only gave me two.","['Educational', 'math']"
https://www.youtube.com/watch?v=dRj3X7IFCjY&pp=ygUEbWF0aA%3D%3D," What up AVG crew today we are well, I am showing DJ animation versus math. I know nothing about this No, he didn't even know the title. Ah The number one yes where it all begins indeed This is straight-up math, okay. Yeah. Oh, wow. Okay, it's straight up math. Oh","['Educational', 'math']"
https://www.youtube.com/watch?v=DlvY_K12Tx0&pp=ygUEbWF0aA%3D%3D," 10 plug board cables, that's... 1,000,000. I've got it. It's million, million. It's in the millions, obviously. It's over 150 million, million, million possible settings. Very good. 159, if you want to be exact about it. 159, with 18 zeros behind it. You see, there are patterns in everything. The colour in light. The reflections on water. In maths,","['Educational', 'math']"
https://www.youtube.com/watch?v=xiz3sEyBx-g&pp=ygUEbWF0aA%3D%3D," Instead of paying attention to books, because what happens in books, you pick up any book of maths, it doesn't cost money to go to the shop and see, go and see, they have made such a thick book and that too is not only of complete maths.","['Educational', 'math']"
https://www.youtube.com/watch?v=3LC0aHSL_Lc&pp=ygUEbWF0aA%3D%3D," Okay, so this looks like a pretty easy problem, but many of you are going to get this wrong, and you'll probably be a little bit shocked, but don't panic. I'm going to fully explain why you're probably going to get this wrong and how to avoid this particular mistake. Now, a lot of you are going to get this right as well. Let me go ahead and tell you the problem. We have 10 divided by 10 cubed. What is the answer? And we don't want to use our calculators. Put that away.","['Educational', 'math']"
https://www.youtube.com/watch?v=QdSUN96eQKY&pp=ygUEbWF0aA%3D%3D," Hello, One. What are you up to? Hello, Zero. Today's the big one. I'm going to count higher than I've ever counted before. Ooh! I've got ten fantastic flippers like this one. Ten tall towers like that one.","['Educational', 'math']"
https://www.youtube.com/watch?v=QU-XUmujbuM&pp=ygUEbWF0aA%3D%3D," Hi, I'm Rob. Welcome to Math Antics. In this lesson, it's finally time for us to learn about time. Like distance, time is something you can measure and represent as a number. But we use different units to measure time and also different devices to make the measurements.","['Educational', 'math']"
https://www.youtube.com/watch?v=eNJoht-Ce3Q&pp=ygUEbWF0aA%3D%3D," Hi guys, it's VT Chergon. In our today's video, we will talk about the long division. So without further ado, let's do this topic. So before we start guys, these are the steps on how to do long division. So we have four different steps. And when you finish this step, just repeat it until you get your final answer. So we have here, D stands for the divide. M, multiply.","['Educational', 'math']"
https://www.youtube.com/watch?v=Y6e4VL7GxDA&pp=ygUEbWF0aA%3D%3D," Do you like sushi? Choose the next episode at the end of the video. You had to wait no less than 30 years, my friends. Three decades to forget the fiasco of the very first movie of the Super Mario Brothers. Okay, I'm still in shock, of course. This ain't no game. Oh no, that's all except a game, my little man. Watch out, I'm telling you. I am Bowser. Stop the massacre! Ah, live action can wreak havoc, believe me.","['Educational', 'math']"
https://www.youtube.com/watch?v=h-CC6jDDahQ&pp=ygUEbWF0aA%3D%3D," Today let us revise the multiplication tables 1, 2, 10 The table of 1 1 1 is 1 2 1's are 2 3 1's are 3 4 1's are 4 5 1's are 5","['Educational', 'math']"
https://www.youtube.com/watch?v=ITOXb8K74is&pp=ygUEbWF0aA%3D%3D, 1 digit addition quiz for kids 2 plus 3 is equal to 5 Let's add the numbers 2 and 3 2 3 Now count together,"['Educational', 'math']"
https://www.youtube.com/watch?v=362JVVvgYPE&pp=ygUEbWF0aA%3D%3D," Oh, hi, everybody. Today, I'm going to talk to you about numbers, and fractions, and maybe even Kevin. Oh, I really like Kevin. OK, so we all know how to count things, right? Yes, of course you do. But do you know how to count parts of things? I will show you. First, we need something that we can count and also divide into equal parts. Uh, how about a pizza?","['Educational', 'math']"
https://www.youtube.com/watch?v=PCy77upPiw0&pp=ygUEbWF0aA%3D%3D," Friends, how are you all? Welcome to your own channel Explained For You. Friends, today we are going to talk about the rule of the board mask. The rule of the board mask is that dangerous thing, which when I saw for the first time, it said,","['Educational', 'math']"
https://www.youtube.com/watch?v=vlYWwA7l-HA&pp=ygUEbWF0aA%3D%3D," One person says, sir, maths does not have marks. Does it come in any other subject or not? That is important. Does it come in any other subject? That means you are not studying maths. Because this is there, but you are using it somewhere else.","['Educational', 'math']"
https://www.youtube.com/watch?v=ZQElzjCsl9o&pp=ygUEbWF0aA%3D%3D," Hi. I want to talk about understanding, and the nature of understanding, and what the essence of understanding is. Because understanding is something we aim for. Everyone. We want to understand things. My claim is that understanding has to do with the ability to change your perspective. If you don't have that, you don't have understanding.","['Educational', 'math']"
https://www.youtube.com/watch?v=rGMecZ_aERo&pp=ygUEbWF0aA%3D%3D," Today we are going to learn about division. Division is such an awesome thing to be able to do, and you're going to have it all figured out. You're going to learn how to divide in this video. And we're going to start off with a story. There's this kid named Ethan, and Ethan loves carrots. He loves carrots so much. He loves to snack on them. He loves when he gets to eat them. They're crunchy. They're tasty.","['Educational', 'math']"
https://www.youtube.com/watch?v=fb_v5Bc8PSk&pp=ygUEbWF0aA%3D%3D," In this video, I'm going to show you how to actually study math. I'm going to give you a step-by-step process that you can follow so you can sit down and actually learn some mathematics. And it really doesn't take that long. If you follow these steps, you'll be able to study smart and make effective use of your time.","['Educational', 'math']"
https://www.youtube.com/watch?v=FJAssUujLTc&pp=ygUEbWF0aA%3D%3D, Assalamualaikum Warahmatullahi Wabarakatuh my dear students,"['Educational', 'math']"
https://www.youtube.com/watch?v=0jHz0onTdsc&pp=ygUEbWF0aA%3D%3D," What's up, mother flippers? It's your boy, Duolingo. Coming at you with a new banger of an app, Duolingo Math. This is a certified hood classic. Give it a try, and I will show you one hell of a math. So what are you a piece of a digested ham sandwich of a loser waiting for? Head to App Store, search for Duolingo Math, and download now.","['Educational', 'math']"
https://www.youtube.com/watch?v=RQ2nYUBVvqI&pp=ygUEbWF0aA%3D%3D," Hi! Welcome to Math Antics. In this lesson, we're gonna learn about ratios. Well, what in the world's a ratio? Well, let's look it up in a math book to find out. It says here that a ratio is a comparison of two numbers by division.","['Educational', 'math']"
https://www.youtube.com/watch?v=EPe86sveyRY&pp=ygUEbWF0aA%3D%3D," You know, as a kid, I used to like math a lot. I liked it so much that I used to do it during my free time. And I was on my way to becoming the Jimmy Neutron, the Phineas and Ferb, you know, the smart characters in TV shows. And for consecutive years, like a dog who sticks by its owner, I was loyal to math. My answer to the question asked most during school, what's your favourite subject, has always been, without fail, math.","['Educational', 'math']"
https://www.youtube.com/watch?v=3uzTABTaX5k&pp=ygUEbWF0aA%3D%3D, hi everyone here we have a nice radical problem which is under root of root of 9 minus square root of 8 equals what so what are we going to do first here is,"['Educational', 'math']"
https://www.youtube.com/watch?v=DGKwdHMiqCg&pp=ygUEbWF0aA%3D%3D," Hi! Welcome to Math Antics. We're continuing our series on Geometry and today we're going to learn about angles. In our last video, we learned about points and lines, and that's good because we're going to need lines to make angles. So let's start with a couple of lines that are in the same plane. We're only going to be dealing with two-dimensional geometry in this video. These lines are conveniently called line AB and line CD.","['Educational', 'math']"
https://www.youtube.com/watch?v=1kQXnA445OY&pp=ygUEbWF0aA%3D%3D," Don't go to that side and cheat and study because this is your chance. I have brought a great trick. Whenever you want to multiply three numbers and zero is coming in the middle, how will you do it, sir? Blow it up and show me how to do it. First of all, you have to multiply these two. 6x4 is 24. Write whatever is written below. After that, multiply these two. 5x7 is 35. Write it here.","['Educational', 'math']"
https://www.youtube.com/watch?v=Mfggw8TBEyo&pp=ygUEbWF0aA%3D%3D, you,"['Educational', 'math']"
https://www.youtube.com/watch?v=JeVSmq1Nrpw&pp=ygUEbWF0aA%3D%3D," Hi! Welcome to Math Antics. Now that you know all about fractions from watching all of our fractions videos, it's time to learn about something called percentages. Percentages are super important. Have you ever been in a math class and heard another student ask the teacher, Um, excuse me, uh, teacher, uh, when are we ever gonna use this stuff? You know, like, in real life?","['Educational', 'math']"
https://www.youtube.com/watch?v=NOCsdhzo6Jg&pp=ygUEbWF0aA%3D%3D," It's 2, then 4, then 8, then it's 16, right? It's very nice. And you know, before I go on with this particular pattern, there's a fun story about it, a little known fact. Do you guys know the song Hallelujah, the one popular from Trent? Yeah, okay, we all know the song. Lots of different artists have played it. The original artist was Leonard Cohen. He was the one to write the lyrics. Few people know, he actually went through many, many different iterations of what the song would be.","['Educational', 'math']"
https://www.youtube.com/watch?v=r5P-f5arPXE&pp=ygUEbWF0aA%3D%3D," Oh boy, math riddles that will stump even your smartest friends! You know, math puzzles continue to become more and more popular. They seem very easy at first, but many people end up getting them all wrong. Do you want to test your logic skills? 1. Let's start easy. Take a look at your telephone's number pad and answer this. What number would you get if you multiply all of its numbers? You have some time to count.","['Educational', 'math']"
https://www.youtube.com/watch?v=yckPYJgjXeY&pp=ygUEbWF0aA%3D%3D, Working outside. I did about an hour of good work and then an hour of absolute wheel spinning. No progress. That's the way it goes. I just had a research paper published and I documented it every step of the way. This is what it took to write and publish this paper. Digital topological groups by Professor Daewoong Lee and me. Did about two hours today. Pretty discouraging results. We'll keep at it.,"['Educational', 'math']"
https://www.youtube.com/watch?v=1yFOe4lbvKM&pp=ygUEbWF0aA%3D%3D, I love you.,"['Educational', 'math']"
https://www.youtube.com/watch?v=lutAxQrIDKI&pp=ygUEbWF0aA%3D%3D," Good morning, kids! Welcome to the first week of our class. It's a week of fun and learning. I am Teacher Frel, your teacher in Math 3, Quarter 1, Week 1, Melt Base. Our lesson for today is about Visualizes numbers up to 10,000 with emphasis on numbers 1,001 to 10,000.","['Educational', 'math']"
https://www.youtube.com/watch?v=0iwilYlQIdk&pp=ygUEbWF0aA%3D%3D," Bonsoir, pensiez que j'allais vous abandonner pendant l'été, hein ? Que nenni ! Hé là-bas ! Hé là-bas ! Où est-ce que vous voulez que j'aille de toute façon ? Il n'y a qu'un intérieur que je peux porter des chemises ouvertes, sinon je suis trempé ! Été 2023, un grand cru ! Alors assieds-toi confortablement, parce que j'ai fait mes petits devoirs. J'ai été vous chercher les cinq histoires qui se cachent derrière des films ou des séries. Ah, je peux vous dire qu'il y a du croquant, bien sûr ! Histoire qu'en soirée, tu puisses lâcher tes petits... Dis donc !","['Educational', 'math']"
https://www.youtube.com/watch?v=tbqU9APUuYI&pp=ygUEbWF0aA%3D%3D, you,"['Educational', 'math']"
https://www.youtube.com/watch?v=GL28FDARts0&pp=ygUEbWF0aA%3D%3D," Assalamualaikum. Today I am going to teach you how to solve all the MCQs of the Trikonviti chapter with the help of a calculator. So you can see that I have taken many MCQs of the Trikonviti chapter here. So those of you who have a high score,","['Educational', 'math']"
https://www.youtube.com/watch?v=B1J6Ou4q8vE&pp=ygUEbWF0aA%3D%3D, you,"['Educational', 'math']"
https://www.youtube.com/watch?v=SEAKuerLbsk&pp=ygUEbWF0aA%3D%3D, Math. Addition flashcards. 1st and 2nd grades. You have about 9 seconds to answer. 5 plus 2 equals 7,"['Educational', 'math']"
https://www.youtube.com/watch?v=06cCHBlj2sw&pp=ygUEbWF0aA%3D%3D," Although the wizards at WizardWatch have not added MiraHawk here into WizardWatch, as you can see, we can take a look in our monster book, in our bestiary, and we can see that MiraHawk is live. That's right, here is MiraHawk. Look at that animation. Look how she","['Educational', 'math']"
https://www.youtube.com/watch?v=RJOyzfjUyx4&pp=ygUEbWF0aA%3D%3D," Welcome you all to a new video. In this video, we are going to discuss about Mathematical FA2 Question and Answer. In this video, we are going to discuss about Mathematical FA2 Question and Answer. In this video, we are going to discuss about Mathematical FA2 Question and Answer. In this video, we are going to discuss about Mathematical FA2 Question and Answer. In this video, we are going to discuss about Mathematical FA2 Question and Answer. In this video, we are going to discuss about Mathematical FA2 Question and Answer. In this video, we are going to discuss about Mathematical FA2 Question and Answer. In this video, we are going to discuss about Mathematical FA2 Question and Answer. In this video, we are going to discuss about Mathematical FA2 Question and Answer. In this video, we are going to discuss about Mathematical FA2 Question and Answer. In this video, we are going to discuss about Mathematical FA2 Question and Answer. In this video, we are going","['Educational', 'math']"
https://www.youtube.com/watch?v=rDds1_V6ZaM&pp=ygUEbWF0aA%3D%3D, hello everyone in this video we are solve this interesting math square root x plus square root minus x is equal to 4 we will find out what is the value of x in this radical problem so first of all i can say here is square root x,"['Educational', 'math']"
https://www.youtube.com/watch?v=85IWWaMpXc8&pp=ygUEbWF0aA%3D%3D," Okay, and the Hua-He Dance event is finally live. Of course, it's a bit late for NA, and I just couldn't make the video yesterday, but hopefully you still find this useful. So, we're gonna talk about how much you need to spend, especially crystals, energy, all of that, in order to maximize the event. So, previously, I believe the Dice events had 15 laps for the worlds, now it has 25.","['Educational', 'math']"
https://www.youtube.com/watch?v=sZLFpoeLYks&pp=ygUEbWF0aA%3D%3D, Hello and welcome. How to solve this radical equation that is the square root of x plus the square root of y equals to the square root of 250 in which x and y are integers. Now we are required to find the pair of values of x and y in integer form that satisfy the equation.,"['Educational', 'math']"
https://www.youtube.com/watch?v=SNOM4V_Xfes&pp=ygUEbWF0aA%3D%3D," Oh, hmm. Huh? Huh?","['Educational', 'math']"
https://www.youtube.com/watch?v=lCOlS_qn8RQ&pp=ygUEbWF0aA%3D%3D," First, draw a circle with diameter 1. Next, draw a square around it so the circle is perfectly inscribed in the square. Notice that this square has perimeter 4. If you add up all the lengths of its sides, each side is length 1, you get 4. Now remove the corners of the square and connect the shape to the circle in this way.","['Educational', 'math']"
https://www.youtube.com/watch?v=DynaLyMWfGc&pp=ygUEbWF0aA%3D%3D," Welcome to Math with Mr. J. In this video, I'm going to cover how to add, subtract, multiply, and divide mixed numbers.","['Educational', 'math']"
https://www.youtube.com/watch?v=eVm063xmnow&pp=ygUEbWF0aA%3D%3D," In the 16th century, the mathematician Robert Record wrote a book called The Whetstone of Wit to teach English students algebra. But he was getting tired of writing the words is equal to over and over. His solution? He replaced those words with two parallel horizontal line segments because the way he saw it, no two things can be more equal.","['Educational', 'math']"
https://www.youtube.com/watch?v=ciFWshTFTcM&pp=ygUEbWF0aA%3D%3D, Hello friend welcome to our channel Salma sir.,"['Educational', 'math']"
https://www.youtube.com/watch?v=tVHOBVAFjUw&pp=ygUEbWF0aA%3D%3D, Welcome to Kids Academy! Hi there! I'm Gwen. I live in Antarctica. Meet my cute fuzzy little penguins. They've been slipping and sliding in the snow all day.,"['Educational', 'math']"
