url,text,tags
https://www.youtube.com/watch?v=EktEEZB8OI4&pp=ygULYyB0dXRvcmlhbHM%3D," Hi, this is Anil with a video tutorial for the Learning Lab on C Programming. In this video tutorial, we are going to see how we can read some characters from the file. So, to read a character from the file, we are going to use a function called fgetc that stands for get a character from the file. So, first we are going to see the syntax of this fgetc. This fgetc function returns the character which is read from the file. So, we have to pass the file pointer","['Educational', 'programming', 'c', 'tutorials']"
https://www.youtube.com/watch?v=U_w-RfMrX18&pp=ygULYyB0dXRvcmlhbHM%3D," In today's video, I will tell you how you can use the open function of offstream to write and read files. Let me quickly create a tut62.cpp file.","['Educational', 'programming', 'c', 'tutorials']"
https://www.youtube.com/watch?v=_FFRRMEXdBU&pp=ygULYyB0dXRvcmlhbHM%3D, Hi everyone and welcome to Apna College and in this video we are going to talk about whether it is necessary to learn C before learning C++ or any other programming language. Now a lot of students who are starting coding or going to new colleges and starting coding,"['Educational', 'programming', 'c', 'tutorials']"
https://www.youtube.com/watch?v=dTp0c41XnrQ&pp=ygULYyB0dXRvcmlhbHM%3D," C language, invented by Dennis Ritchie at AT&T Bell Laboratories in the early 1970s. Many of the ideas of C language were taken from the earlier B language and its ancestors. C is a middle-level programming language. Because of that, we can use C for system-level programming like writing operating systems and also for developing games and applications.","['Educational', 'programming', 'c', 'tutorials']"
https://www.youtube.com/watch?v=E6jtj-7xJoA&pp=ygULYyB0dXRvcmlhbHM%3D, In the previous video we have discussed what is need of programming? Why do you write program? So let me give you a brief summary of the previous lecture. See computer is a general purpose machine which can perform any computational task. And how computer can perform any task? You have to submit some instruction. Whenever you give some instruction according to those instructions computer will perform some task. Right?,"['Educational', 'programming', 'c', 'tutorials']"
https://www.youtube.com/watch?v=5SIBB589fAg&pp=ygULYyB0dXRvcmlhbHM%3D," Guys, in this video, I will tell you the basic structure of C program. From this video, we will start our C programming course. This video is going to be very important. So, watch this video completely.","['Educational', 'programming', 'c', 'tutorials']"
https://www.youtube.com/watch?v=stsfIQQqLCw&pp=ygULYyB0dXRvcmlhbHM%3D," Hello friends, welcome to Telugu Soft. In this video, we will see how to add, subtract, multiply and divide two numbers. First, we will do the addition and then we will see the rest. For two numbers, we are declaring two variables. When we add, we add 10.2 plus 5.3 like this. That's why we are taking the float data type. Now we are taking two variables x and y.","['Educational', 'programming', 'c', 'tutorials']"
https://www.youtube.com/watch?v=8Uuhqri-Ejk&pp=ygULYyB0dXRvcmlhbHM%3D," Hello everyone! Welcome to my channel! If you are new to this channel, please watch this video first. First of all, before I give examples on how to create running programs using C programming language.","['Educational', 'programming', 'c', 'tutorials']"
https://www.youtube.com/watch?v=l-bHUneX3pg&pp=ygULYyB0dXRvcmlhbHM%3D, Exam season is going on. Some students are ready for the exam.,"['Educational', 'programming', 'c', 'tutorials']"
https://www.youtube.com/watch?v=cuh-5AE0AHs&pp=ygULYyB0dXRvcmlhbHM%3D," Hey, what is up, everybody? It is Caleb. In this video, we are going to be talking about loops. So up to this point, our programs have been fairly linear or, like, one step after the other going in a straight line. And we can branch, which just allows us to go straight in, like, a different direction. But now what if we want to, like, go back and do something again? Well, that is done with a loop. So loops allow us to do some section of code as many times as we would like.","['Educational', 'programming', 'c', 'tutorials']"
https://www.youtube.com/watch?v=KZR_UUcOyrg&pp=ygULYyB0dXRvcmlhbHM%3D," Hi everyone, I am your Shraddha Didi and welcome to Apna College. In today's video, we are going to discuss in detail and very easily that if you want to start coding in 2023, then how can we do it? Whether you want to prepare for placement, whether you want to learn web development, want to make projects or want to do things like machine learning AI. In this video, we will talk about different technologies and decide which one you should learn. Along with that, we will also talk about resources that from where you can learn those technologies.","['Educational', 'programming', 'c', 'tutorials']"
https://www.youtube.com/watch?v=qJfP6-_P_x8&pp=ygULYyB0dXRvcmlhbHM%3D," Hello friends, in this video, we will see how to get the values from the user as input. In the previous video, we have already learned about data types and variables. For example, to declare a variable, first we give the data type and then we write the variable name. To give value to this variable, we give a is equal to 10. If we want to change a value, again in the program, we give a is equal to 20.","['Educational', 'programming', 'c', 'tutorials']"
https://www.youtube.com/watch?v=_FOkG5D4NBo&pp=ygULYyB0dXRvcmlhbHM%3D," So in this series of learning programming in C, today I am going to talk about the execution process of a C program. In the previous video I have discussed structure of a C program. But now we will see the execution process of a C program. Like I have discussed what is the model of execution, here translation, linking and loading. So what is this model, what is translation, what is linking, what is loading and when it comes.","['Educational', 'programming', 'c', 'tutorials']"
https://www.youtube.com/watch?v=sB7YGSbAIvQ&pp=ygULYyB0dXRvcmlhbHM%3D," So, here in the last session we discussed how to communicate with the computer. So, finally, as of our discussion we using computer languages we are developing applications. So, here now the question is sir what type of applications we can develop using computer language.","['Educational', 'programming', 'c', 'tutorials']"
https://www.youtube.com/watch?v=6S5KRJv-7RU&pp=ygULYyB0dXRvcmlhbHM%3D," Assembly language is the language that computers speak. It's not C. It's not Python. It's not JavaScript. And before you say, well actually, triple L, computers speak machine code, we all know that assembly is the human readable version of machine code. And while assembly may seem like an alien language, it's actually really easy to learn.","['Educational', 'programming', 'c', 'tutorials']"
https://www.youtube.com/watch?v=iviYixpXUm8&pp=ygULYyB0dXRvcmlhbHM%3D," In the series of learning programming in C we have discussed all the loops for while do while as well as we have discussed nested loops nested for nested while nested do while loop right. So now from this video I am going to start discussing some programs printing pattern programs 5, 4, 10 printing pattern programs we are going to discuss right. But first in this video we will discuss how to print this pattern right. But first please check out that video where I have discussed what is need of nested loops","['Educational', 'programming', 'c', 'tutorials']"
https://www.youtube.com/watch?v=E68uezDkQxc&pp=ygULYyB0dXRvcmlhbHM%3D," Dear students, welcome to GITsmeasures. In this video I am going to explain 4-loop in C programming. So already we have discussed about while loop and do-while loop. With examples I have told you the story. I have told you the main important part or crux of it. So in such 4-loop the main important part or crux of it is","['Educational', 'programming', 'c', 'tutorials']"
https://www.youtube.com/watch?v=wR_SHkqDhcc&pp=ygULYyB0dXRvcmlhbHM%3D," Hi everyone, welcome to Telugu Skit Tutorials. This is Chandrakala. For the last few sessions, we are discussing about the introduction to C language.","['Educational', 'programming', 'c', 'tutorials']"
https://www.youtube.com/watch?v=Npo1u37lcg8&pp=ygULYyB0dXRvcmlhbHM%3D," Hey guys, this is me Padma from Programming and welcome back to this series on C programming. In this video, we'll learn about functions to divide our program into small blocks of code. We'll also learn different types of function available in C programming. So let's get started. In programming, a function is a group of related statement that perform a specific task. They help us divide a large program into smaller chunks so that it is easier to understand and modify them","['Educational', 'programming', 'c', 'tutorials']"
https://www.youtube.com/watch?v=yOyaJXpAYZQ&pp=ygULYyB0dXRvcmlhbHM%3D," So I have a program here that prints out Fibonacci numbers, and I want to walk through how we get this program compiled to machine code and running on the computer. But first of all, just to see kind of what the output of this looks like when we run it, is it prints out Fibonacci numbers up to 255, and actually 233 is the largest Fibonacci number that's less than 255. And then it just starts over, and it just does this, it just does this forever and ever.","['Educational', 'programming', 'c', 'tutorials']"
https://www.youtube.com/watch?v=A_IgufxmIHk&pp=ygULYyB0dXRvcmlhbHM%3D," In this video, I will tell you what are loops and how you can use loops to write efficient programs. Watch this video completely so that what I am telling you here, what I have learned related to my experience and what I have learned in a difficult way, I am going to teach you easily in this video. Keep watching.","['Educational', 'programming', 'c', 'tutorials']"
https://www.youtube.com/watch?v=gt9YPl6O9ZM&pp=ygULYyB0dXRvcmlhbHM%3D," Hey guys, this is me Padma from Programis and welcome back to this series on C programming. In this video, we will learn about struct in C. More specifically, we will learn to store related data together under a single name using struct. So let's get started.","['Educational', 'programming', 'c', 'tutorials']"
https://www.youtube.com/watch?v=lMvFWKHhVZ0&pp=ygULYyB0dXRvcmlhbHM%3D," Hey guys, for the past two years I've been using the C programming language for almost all of my projects. This video is about my journey through being completely clueless to relatively okay at the language.","['Educational', 'programming', 'c', 'tutorials']"
https://www.youtube.com/watch?v=_bQ5_RvKoVU&pp=ygULYyB0dXRvcmlhbHM%3D," If you are thinking I am going to tell you any shortcut to learn a programming language then this video is definitely for you. I am not going to tell you any shortcut because there is no shortcut to learn a programming language. What I am going to tell you in this video is the right path to learn a programming language, best way to learn a programming language.","['Educational', 'programming', 'c', 'tutorials']"
https://www.youtube.com/watch?v=aS3_7riLVYk&pp=ygULYyB0dXRvcmlhbHM%3D," If I ask you which programming language will you choose for banking, computer operating system or video game making, what will be your answer? You will definitely say that I will choose Python or C programming language, right? Have you ever thought about why your university teaches you C programming? And why C programming language is called parent or mother language?","['Educational', 'programming', 'c', 'tutorials']"
https://www.youtube.com/watch?v=oWTnLzWkF5w&pp=ygULYyB0dXRvcmlhbHM%3D," So in the series of learning programming in C, in the previous video I have discussed about if statement, right? Everything about if statement, every single detail with the help of a flowchart and program, what tricky type of questions can be asked using that if statement. That also we have discussed, what kind of error you can do while writing if statement in your program, right? Everything we have discussed. Now in this video I'll be discussing about if-else statements.","['Educational', 'programming', 'c', 'tutorials']"
https://www.youtube.com/watch?v=WJznertdKXg&pp=ygULYyB0dXRvcmlhbHM%3D," C Programming Step by Step, Lecture 03 Integer and Long-Long Integer. So, we will work practically in this lecture. In the beginning, I took an integer variable a. Then, I took another integer variable b. That means, a and b can hold two integer values. If I put n in a, and if I put c in b, then if I print, result is","['Educational', 'programming', 'c', 'tutorials']"
https://www.youtube.com/watch?v=NtYHC1KNGoc&pp=ygULYyB0dXRvcmlhbHM%3D," It's a debate as old as time, or roughly eight years, whichever you consider older. Which language should you learn first, C or Rust? To help me settle this debate, I've recruited some friends of mine from college to give us their opinions on the topic. Sup, my name's Kyle, UC Berkeley 2022, Go Bears, and I'm a Rust programmer.","['Educational', 'programming', 'c', 'tutorials']"
https://www.youtube.com/watch?v=IGuoF98qEG0&pp=ygULYyB0dXRvcmlhbHM%3D," In the series of learning programming in C, in the previous video I have discussed a program using for loop. We have written a program to print multiplication table of a number with for loop. We have discussed everything about for loop, the general syntax working of for loop with the help of programs as well as","['Educational', 'programming', 'c', 'tutorials']"
https://www.youtube.com/watch?v=14BL_FwQCpM&pp=ygULYyB0dXRvcmlhbHM%3D," This is how I learned to code in JavaScript, Python, and C++ by spending only a few weeks on each of them. But learning a new programming language was not always as easy as this. When I learned my first programming language which was Java, I spent months watching online tutorials and following along. But when I joined Amazon,","['Educational', 'programming', 'c', 'tutorials']"
https://www.youtube.com/watch?v=Bjzfag1zZPg&pp=ygULYyB0dXRvcmlhbHM%3D," Hello Friends, In this series of C Language, today's first chapter is Introduction to C Language. As we are starting C Language, I am assuming that this may be your first programming language. So, we will cover very fundamental things in this. It is possible that you have read any language before, still you will find all these tutorials very useful. Let's see what we are going to see in today's lecture.","['Educational', 'programming', 'c', 'tutorials']"
https://www.youtube.com/watch?v=n7g4keSd0kk&pp=ygULYyB0dXRvcmlhbHM%3D," Welcome back everyone, it is Caleb from Caleb the Video Maker 2! And I'm assuming, from the last video, you got your first program running. That was the goal. If you've had some experience and you are familiar with some of the things in the previous video, that's okay. But I am going to teach as if you don't know anything. So the program we wrote had a lot of commands and keywords and all these fancy things in there. And the chances are, at first you're just going to have to memorize how to type this stuff out.","['Educational', 'programming', 'c', 'tutorials']"
https://www.youtube.com/watch?v=SFo205wqn8w&pp=ygULYyB0dXRvcmlhbHM%3D, hello friends today i will discuss the topic what is loop and how many types of loop define with syntax so first of all we discuss about the loop so here we write what is loop and answer any repeated task any repeated task more than one time is called loop i explain in hindi,"['Educational', 'programming', 'c', 'tutorials']"
https://www.youtube.com/watch?v=7tfh5K1PN7c&pp=ygULYyB0dXRvcmlhbHM%3D," Oh,","['Educational', 'programming', 'c', 'tutorials']"
https://www.youtube.com/watch?v=gEJBFKDkqTE&pp=ygULYyB0dXRvcmlhbHM%3D," Hey guys, I am Hussainia from the Simply Learns team. Welcome to this video on a brief introduction to C programming language. C is one of the most popular, general purpose and procedural programming languages which also happens to be one of the fundamentals if you wish to learn program. As most of the programming paradigms of the latest and most powerful languages are being sourced from C. More on that later, without any further delay, let's get started with the agenda for today's session.","['Educational', 'programming', 'c', 'tutorials']"
https://www.youtube.com/watch?v=iGenyxwahTw&pp=ygULYyB0dXRvcmlhbHM%3D," programming step-by-step, lecture 17, array introduction. We can also think of a real-life scenario. For example, there are 10 students in a class. To store the CGPA of 10 students, we need to write a code.","['Educational', 'programming', 'c', 'tutorials']"
https://www.youtube.com/watch?v=DDQaAvtP19k&pp=ygULYyB0dXRvcmlhbHM%3D," To learn programming, subscribe to our channel Learn Coding. In today's video, we will show you how to download and install Visual Studio Code. In addition to this, how to make C and C++ programs in Visual Studio Code, how it will run, we will tell you all these things in detail. So let's start. First of all, we are opening our Google Chrome browser. To download Visual Studio Code, you have to write here","['Educational', 'programming', 'c', 'tutorials']"
https://www.youtube.com/watch?v=2ybLD6_2gKM&pp=ygULYyB0dXRvcmlhbHM%3D," One of the hardest things for new programmers to learn is pointers. Whether it's pointers by themselves, pointers that point to arrays, or pointers that point to pointers, something about this concept just drives people crazy. And if you're a new programmer, you're not alone. I was one of those people when I learned C back in the day, and like you, I was eager to understand.","['Educational', 'programming', 'c', 'tutorials']"
https://www.youtube.com/watch?v=6Dl_gkr0Lmw&pp=ygULYyB0dXRvcmlhbHM%3D," I welcome all of you. I am Anishul Islam. In this video, I will discuss the course plan of C Programming. I will give you a basic idea of what will be there in this video series of C Programming. I have initially prepared a list. I will cover all the topics in this video series of C Programming. The names of each topic are mentioned here. You can read it for 2-1 minute.","['Educational', 'programming', 'c', 'tutorials']"
https://www.youtube.com/watch?v=9s29LKfEFjQ&pp=ygULYyB0dXRvcmlhbHM%3D," This is how I would learn to code if I could start over. For context, I work at Microsoft, but before that, I did six internships across three countries. So yeah, I've done a line or two in my life. Wait, not like that. What the f- To tell you what I would change, I first need to tell you what I did. I started coding in grade 11. Well, sorta. We started with this language called Scratch. It's basic game development made for children. Nobody would be stupid enough to, let's say, do an entire Google coding interview in this language, and maybe even do shots every time the code fails. So let's just skip that and get to the important stuff.","['Educational', 'programming', 'c', 'tutorials']"
https://www.youtube.com/watch?v=_N6j8HXPt2U&pp=ygULYyB0dXRvcmlhbHM%3D," It was 2015 and I had written my first code on paper. I had to take C++ in 11th and 12th because the school didn't let me take physical education. But I didn't know that I would love programming so much that I would learn it, do it and teach it to others. I liked coding because it didn't have as much calculation as maths but it had a lot of logic.","['Educational', 'programming', 'c', 'tutorials']"
https://www.youtube.com/watch?v=Wa-kgmSLls4&pp=ygULYyB0dXRvcmlhbHM%3D," Guys, through today's video, you will understand the meaning of coding and the right reason for programming.","['Educational', 'programming', 'c', 'tutorials']"
https://www.youtube.com/watch?v=U3aXWizDbQ4&pp=ygULYyB0dXRvcmlhbHM%3D," C, a statically-typed procedural programming language famous for making the world go round. It's the language behind many tools we take for granted, like the Windows, Linux, and Mac operating system kernels, databases like MySQL, interpreters for languages like Python, tools like Vim and Git, and countless others.","['Educational', 'programming', 'c', 'tutorials']"
https://www.youtube.com/watch?v=ILlU1Z6Didg&pp=ygULYyB0dXRvcmlhbHM%3D, Hi my name's Jen and I'm from Hip Hop Pop in Harlow and I'm here with James the Breakdance Tutor. Today I'm going to show you how to do some street dance moves step by step. In this video I'm going to show you how to Crip Walk step by step. Now Crip Walking is a footwork style created by the Crips gang in the USA in the 70s but since then it's become quite a commercial style of dancing and it's all to do with your feet. Now today we're going to show you the basic V step,"['Educational', 'programming', 'c', 'tutorials']"
https://www.youtube.com/watch?v=KlEsZLmvdvU&pp=ygULYyB0dXRvcmlhbHM%3D," If you have been thinking about learning C programming language for a long time, but so many available languages are confusing you and you are not able to understand whether this decision will be fruitful for your career or not, then you don't have to worry about it. Because today we are going to tell you that by learning C programming language, you can take your career in which direction.","['Educational', 'programming', 'c', 'tutorials']"
https://www.youtube.com/watch?v=TxWKGhF9KdM&pp=ygULYyB0dXRvcmlhbHM%3D," Welcome to Naresh Technologies, this is Srinivas. So, in the last session, so we had discussed, so what is a variable and what is a function. So, these two are the main building blocks to develop application, so to write a program.","['Educational', 'programming', 'c', 'tutorials']"
https://www.youtube.com/watch?v=rLf3jnHxSmU&pp=ygULYyB0dXRvcmlhbHM%3D," If you remember in our previous lesson that is introduction to programming and data structures, we had talked about two most important features of C programming. Those were portability and less lines of codes. Let's explore some more features of C programming. Have you ever wondered why a company like Google, for example, has separate departments for carrying out different tasks for the same job?","['Educational', 'programming', 'c', 'tutorials']"
https://www.youtube.com/watch?v=BkzPdgdxWBY&pp=ygULYyB0dXRvcmlhbHM%3D," There are hundreds of videos on YouTube about the top programming languages to learn. But there are almost no videos that tell you the languages that you should avoid as a beginner. Learning programming by picking a wrong language is like using a hammer for a screw. It might work in the end, but there'll be a lot of damage in the process. For a new programmer, this damage might look like difficulty to make progress.","['Educational', 'programming', 'c', 'tutorials']"
https://www.youtube.com/watch?v=AMU3xDnECsU&pp=ygULYyB0dXRvcmlhbHM%3D," What is up, everyone? It's Caleb from Caleb the Video Maker 2. In this video, we are going to introduce using functions in C. I've talked about this a little bit, and I mentioned a little bit about what functions are and how to use them. But I wanted a video just to introduce a little bit more detail. So that way, as we use functions, you're not like, what the heck is he doing? So that way you have a better idea of what's going on when we start typing out more code and everything.","['Educational', 'programming', 'c', 'tutorials']"
https://www.youtube.com/watch?v=IFayQioG71A&pp=ygULYyB0dXRvcmlhbHM%3D," In this video, we're going to learn C Sharp basics in just 10 minutes. Variables, ifs, functions, classes, and more. Alright, let's begin! Okay, so let's learn the basics on how to write C Sharp code. Now, the first thing you need is somewhere to write and compile your code. The easiest way is simply to use Visual Studio, which has a free version. Creating a simple console app is the easiest way to start playing around and writing some C Sharp.","['Educational', 'programming', 'c', 'tutorials']"
https://www.youtube.com/watch?v=TT16OTNPyEk&pp=ygULYyB0dXRvcmlhbHM%3D," I never lose, but if I do, I know it's rare","['Educational', 'programming', 'c', 'tutorials']"
https://www.youtube.com/watch?v=q1ZmFc-sqNc&pp=ygULYyB0dXRvcmlhbHM%3D," A lot of people don't like C++ when compared to its parent, C. C++ is misunderstood. Or is it? Should you even learn C++? C with classes, later renamed to C++, was invented by Jarnay Stroutsup in 1979. The more general aim was to design a language in which I could write programs that were both efficient and elegant. Many languages force you to choose between the two alternatives. Since the initial release of the language, C++ has grown substantially, while adhering to three core principles.","['Educational', 'programming', 'c', 'tutorials']"
https://www.youtube.com/watch?v=keHescVGYsc&pp=ygULYyB0dXRvcmlhbHM%3D," So, hello everyone, how are you all? As you can see, today I am going to start a new topic, Data Structure. So, basically in this Data Structure, I am going to implement the stack. How we perform push operations, pop operations in stack. So, without delay, let's start. So, I am going to implement it on C, Turbo C. You can also do it on any other platform. You can also do it on online C compiler. So, let's start without delay.","['Educational', 'programming', 'c', 'tutorials']"
https://www.youtube.com/watch?v=kMbB3fqF-SU&pp=ygULYyB0dXRvcmlhbHM%3D," Hi everyone, welcome to Telugu Skit Tutorials. This is Chirumika. Today, we are going to learn a new language. When we learn computer programming languages, basically, in any program, the first language we learn is C language. Why does everyone learn this first?","['Educational', 'programming', 'c', 'tutorials']"
https://www.youtube.com/watch?v=dhh5lrXXXYw&pp=ygULYyB0dXRvcmlhbHM%3D, So in the series of learning programming in C in the previous video I have discussed constants in C what are different type of constants and how to declare constants everything we have discussed some valid constants some invalid constants right in this video I am going to talk about variables in C language right these things we will be using when we will write a program variables constants data types functions everything,"['Educational', 'programming', 'c', 'tutorials']"
