url,text,tags
https://www.youtube.com/watch?v=NjNc6gGZAYs&pp=ygULcGMgaGFyZHdhcmU%3D," When you hear the word computer, the first thing that comes to your mind is a TV-like screen, which is called a monitor. Next to it, there is another thing that looks like a box. This is a computer, which is called a PC. Let's get to know about computers. A computer is basically a combination of two things, hardware and application software.","['Technology', 'pc hardware']"
https://www.youtube.com/watch?v=fUWd1ipOTAw&pp=ygULcGMgaGFyZHdhcmU%3D," Welcome back to Paul's Tech News. It is good to be back, my friends, bringing you the tech news, summing up the entirety of the past week's PC hardware triumphs and fiascos and maintaining a casual yet aloof perspective so we can easily switch between the biting sarcasm and the hardcore roasting that some tech companies bring upon themselves with their shenanigans and skullduggery.","['Technology', 'pc hardware']"
https://www.youtube.com/watch?v=cvnMKHVXzy0&pp=ygULcGMgaGFyZHdhcmU%3D," Today's video was supposed to be about this system right here, which I built back in December and has a bit of a saga, a bit of a story behind it, but that's going to need to wait till a little bit later. Because of some of the issues and delays with this system, I am wedging in a quick probing Paul video. This is actually my second for April, but this is typically a monthly Q&A series, and I'm going to start with a very important question. What is the best bang for the graphics card you can buy right now?","['Technology', 'pc hardware']"
https://www.youtube.com/watch?v=A4O2SKota88&pp=ygULcGMgaGFyZHdhcmU%3D, Hi friends and welcome back to my channel Lotus Geek. In this video I have come up with a solution to fix your error your PC doesn't meet the hardware requirement for capture or for game DVR. So let's go ahead and proceed. Open your Google Chrome and type here Game DVR config download and then hit the enter key. Here is the first link click on it,"['Technology', 'pc hardware']"
https://www.youtube.com/watch?v=cBz9JmjdEBM&pp=ygULcGMgaGFyZHdhcmU%3D," In today's tutorial, we are going to explain how to disable an automatic scan of a laptop. In today's case, we have a HP laptop, as we can see here. And the problem is that every time we turn it on, an automatic scan comes out, scanning each component of the computer. It is very good, but when it comes out automatically, it starts to bother and we are going to disable this option. What we are going to do is the following. We are going to turn on our laptop.","['Technology', 'pc hardware']"
https://www.youtube.com/watch?v=ExxFxD4OSZ0&pp=ygULcGMgaGFyZHdhcmU%3D," If you work with computers, you've likely heard terms like RAM, hard drive, and processor mentioned by tech support or others who are more interested in what goes on inside of a computer's case. If you've always wondered what the various components of your computer are for, but have never really had the time to look into it, then this video is just for you. While each one of these components is complex enough to spend a lifetime learning about, I'm going to give a very broad and general overview.","['Technology', 'pc hardware']"
https://www.youtube.com/watch?v=IwsStNJFHpU&pp=ygULcGMgaGFyZHdhcmU%3D," In this course of Computer Fundamentals, today's topic is Hardware. In this video, we will tell you what is hardware? We will discuss all the components of hardware in detail. So first of all, you should know what hardware means.","['Technology', 'pc hardware']"
https://www.youtube.com/watch?v=_ZpRSapnXsI&pp=ygULcGMgaGFyZHdhcmU%3D," Welcome back to Paul's Tech News. First of all, how dare you? How dare you not buy all the graphics cards that are just sitting there waiting on store shelves, beckoning you with their come-hither cooling solutions and their provocatively exposed PCI Express connectors. For four plus weeks now, you, specifically you, have fallen way behind on your GPU buying quota","['Technology', 'pc hardware']"
https://www.youtube.com/watch?v=kcTIxqTQdGU&pp=ygULcGMgaGFyZHdhcmU%3D," I haven't been this excited to rummage in the guts of a bit of tech for a long time, because this couple generation old knock has some pretty wild hardware in a tiny form factor, so I can't wait to tear it apart and game on it. But first, today's video is sponsored by Linode, or by its new underground street fighting name, Akamai.","['Technology', 'pc hardware']"
https://www.youtube.com/watch?v=K3F580_nxqY&pp=ygULcGMgaGFyZHdhcmU%3D," Assalamualaikum. Welcome to Creative IT Academy. Today we will talk about the basic computer. For those who are new to computers, those who don't know anything about computers, and those who want to buy and learn computers, today's basic course is for them. So, we are not familiar with computers in the basic course. Let's get familiar.","['Technology', 'pc hardware']"
https://www.youtube.com/watch?v=m_-G9Cacx2U&pp=ygULcGMgaGFyZHdhcmU%3D, you,"['Technology', 'pc hardware']"
https://www.youtube.com/watch?v=jE3DkdQj_3Q&pp=ygULcGMgaGFyZHdhcmU%3D," We're building a gaming PC using all parts from Teemu. Well, not exactly. We bought a bunch of PC hardware from Teemu because they don't have everything you need, but we wanted to take a look at what they had right now and see if you should buy it today. Before we dive into today's video, let's hear a word from today's sponsor.","['Technology', 'pc hardware']"
https://www.youtube.com/watch?v=nvPNbJXqOEY&pp=ygULcGMgaGFyZHdhcmU%3D," What happens if you install Windows 11 on an unsupported PC or hardware? What hardware is supported for Windows 11? Does your PC meet Windows 11 requirements? Windows 11 is not supported on all PC hardware configurations. Microsoft has made some changes to the requirements for installing Windows operating systems, such as Mandatory Secure Boot and TPM 2.0. This is why Microsoft doesn't recommend installing Windows 11 on unsupported devices.","['Technology', 'pc hardware']"
https://www.youtube.com/watch?v=bEVzMSofXSg&pp=ygULcGMgaGFyZHdhcmU%3D," Hello everybody and welcome back to Computex 2023. We're here at the Lian Li booth and oh my word, they've got some stuff on show. You just wait till we show you the fans in a second. It's unreal, it's going to change everything. But anyway, let's start by talking about the cases because they've actually refreshed the range of 0.11 cases. The new 0.11 range has been made to be a lot simpler, easier to understand and still offer you this sort of showcase level PC gaming experience but support more and more features while still having a case that just looks absolutely phenomenal.","['Technology', 'pc hardware']"
https://www.youtube.com/watch?v=XA4QH7SO8J4&pp=ygULcGMgaGFyZHdhcmU%3D," Hey, what's going on guys, JS2Sense here, and I just kind of want to come at you with a talking head, more of a venting piece for my own mental state at this point. And speaking of state, I'm referring to the state of emergency that is literally the PC industry as a whole right now. And as an enthusiast, it's extremely infuriating, extremely frustrating to try and be able to like, just enjoy any of this crap right now when you got companies that are just absolutely dog s*** right now.","['Technology', 'pc hardware']"
https://www.youtube.com/watch?v=amVP96OYfUg&pp=ygULcGMgaGFyZHdhcmU%3D," I love Raspberry Pis and other single-board computers, but they can often be underpowered, incompatible with software, or just really expensive. I also love desktop computers for their performance and expandability, but they can often just take up a lot of space. I mean, look at my office right now, for example. What if you need something small and efficient that also has great performance and compatibility?","['Technology', 'pc hardware']"
https://www.youtube.com/watch?v=XmfCrm0W6Fw&pp=ygULcGMgaGFyZHdhcmU%3D," Well yes, that is a giant cat on the side of a building in Tokyo Shinjuku district. Not what you expected when you clicked on this video? No? Now you know how I felt on my recent trip to Japan.","['Technology', 'pc hardware']"
https://www.youtube.com/watch?v=ekjZfvQQkG0&pp=ygULcGMgaGFyZHdhcmU%3D, There was some pretty cool hardware at CES 2018. In this video will be some clips of what I saw.,"['Technology', 'pc hardware']"
https://www.youtube.com/watch?v=8_itvuz5Dc4&pp=ygULcGMgaGFyZHdhcmU%3D," Welcome to LearnComputerScienceOnline.com, and in this video, we are going to discuss, What is Computer Hardware? Let us first start with, a simple introduction to the computer hardware. The computer system, basically consists of, two types of components.","['Technology', 'pc hardware']"
https://www.youtube.com/watch?v=WlSYwDIujtk&pp=ygULcGMgaGFyZHdhcmU%3D," Even if my jokes aren't funny, my day died upon it. And I don't need to speak a single word, cause you got me on your phone.","['Technology', 'pc hardware']"
https://www.youtube.com/watch?v=J3AZYUMZJIY&pp=ygULcGMgaGFyZHdhcmU%3D," Hello, nice that you're here. Jedi Survivor has been released and we've been looking forward to it for a few hours now. We've been waiting for the Day 1 patch, because the game has been officially spawned at 6 a.m. today. We've already played several missions and wanted to show you what kind of hardware you need and what kind of hardware you don't need, because there are always a few wrong feelings and rumors about what you need and what you don't.","['Technology', 'pc hardware']"
https://www.youtube.com/watch?v=PRbMfZKuRUo&pp=ygULcGMgaGFyZHdhcmU%3D, All I do is get all tangled up. One of those stupid brick is...,"['Technology', 'pc hardware']"
https://www.youtube.com/watch?v=D2VAYCgWgl0&pp=ygULcGMgaGFyZHdhcmU%3D, Welcome to GUNDUPAIYAN CHANNEL Today we are going to see UEFI How do we do Hardware Dynastics in HP Laptop with UEFI Note this carefully When you turn on the power Press the F2 button continuously Look at the screen Press the F2 button continuously,"['Technology', 'pc hardware']"
https://www.youtube.com/watch?v=RrFQZ5wCscw&pp=ygULcGMgaGFyZHdhcmU%3D, How to Navigate the New Features of HP PC Hardware Diagnostics in Windows The HP PC Hardware Diagnostics Windows tool has been updated to include new user interface themes and privacy settings. The tool ships pre-installed on all new HP devices with Windows 11 and is supported on devices with the Windows operating system going as far back as Windows 7.,"['Technology', 'pc hardware']"
https://www.youtube.com/watch?v=AWAvqyzXvTI&pp=ygULcGMgaGFyZHdhcmU%3D," Hey guys and welcome to Hardware Deals. My last PC assembly guide is now exactly 2 years old and because a lot has changed in the meantime, especially when it comes to CPU sockets and memory media, I thought I'd put it all back together.","['Technology', 'pc hardware']"
https://www.youtube.com/watch?v=lGF-lxL_ZCQ&pp=ygULcGMgaGFyZHdhcmU%3D," Whispered promises, straight to my heart","['Technology', 'pc hardware']"
https://www.youtube.com/watch?v=d86ws7mQYIg&pp=ygULcGMgaGFyZHdhcmU%3D," Throughout this video, we're going to do a desktop computer dissection using 3D animation, kind of like a dissection lab in biology class. But instead, we'll journey through the inside of this computer and disassemble every piece of hardware. We'll then use a microscope and zoom in to give you a nanoscopic view of the transistors and other structures inside. To make this video, we disassembled all the hardware inside a typical desktop computer.","['Technology', 'pc hardware']"
https://www.youtube.com/watch?v=jhXaAVEjGMw&pp=ygULcGMgaGFyZHdhcmU%3D," Come eseguire HP PC Hardware Diagnostics in Windows 11. HP PC Hardware Diagnostics per Windows permette di isolare e identificare i problemi hardware sul computer HP. HP PC Hardware Diagnostics per Windows è preinstallato sui nuovi computer HP, altrimenti è possibile scaricarlo all'indirizzo hp.com barra go barra techcenter barra diags.","['Technology', 'pc hardware']"
https://www.youtube.com/watch?v=fti7800_vQM&pp=ygULcGMgaGFyZHdhcmU%3D," Hey guys, Jarrod here, and today I'm going to tell you how I saved over $500 on my new PC. As you may know, I've been looking at Threadripper hardware recently for my new computer. I'm currently using a computer that's almost 7 years old now, and it's pretty bad. It's slowing me down quite a lot, and I've been looking at Threadripper as the solution, as it's got a lot of CPU cores for a fairly good price. The problem that I've been having with this though, is that a lot of the components I need for a Threadripper build are fairly expensive here in Australia.","['Technology', 'pc hardware']"
https://www.youtube.com/watch?v=bBfzizeLD_Y&pp=ygULcGMgaGFyZHdhcmU%3D," We now have a ton of information about Starfield including this like 45 minute gameplay deep dive video I'll have all my sources today linked in the video description so you can be sure to check them out But we also have system requirements for the PC, but some other information you may be interested in as well You know, let me pause this video in the background while we switch tabs here we have some questions about how is it gonna run on consoles and","['Technology', 'pc hardware']"
https://www.youtube.com/watch?v=ON711s65eKc&pp=ygULcGMgaGFyZHdhcmU%3D," Hello everyone. Since the lockdown has started, the demand for gaming PCs has increased a lot. A lot of people are buying gaming PCs. But there are also a lot of people who do not know much about PCs. So this video is for them. In this video, we will know that how many components are there in a gaming PC and what is its function. And what things you should keep in mind while building your gaming PC. So if you are new to the channel, then please subscribe to the channel. And share this video with your friends. Let's move towards our video.","['Technology', 'pc hardware']"
https://www.youtube.com/watch?v=q-s55tHQXSE&pp=ygULcGMgaGFyZHdhcmU%3D," Hello and welcome to new episode. Today I have a new microcontroller board and for the first time I'm using Raspberry Pi 2040 board. You are probably familiar with this ESP32 board, this is T-Display, TTGO T-Display board and","['Technology', 'pc hardware']"
https://www.youtube.com/watch?v=ToZEJGUE_Nc&pp=ygULcGMgaGFyZHdhcmU%3D," Hey guys, my name is Abdul Rashid and you are watching The Indian Budget Gamer. Today's video is going to be very interesting. Normally, we make videos on value for money products. But today we are going to talk about such products that were launched in the gaming market, but could not run that well and failed badly. We are making this video so that if you are going to build a PC for yourself, then avoid those PC parts.","['Technology', 'pc hardware']"
https://www.youtube.com/watch?v=aGtJxaf7QB8&pp=ygULcGMgaGFyZHdhcmU%3D," With all these new AAA games coming out, you may be interested in learning how to monitor your PC's stats while dominating your opponents. Logitech provide a free app for your mobile device called ARX Control, available for iOS and Android. Just download this app and also get the Logitech gaming software for your PC. Once connected, the software will send real-time usage reports to your mobile device.","['Technology', 'pc hardware']"
https://www.youtube.com/watch?v=8C_kHJ5YEiA&pp=ygULcGMgaGFyZHdhcmU%3D," Hi everyone and welcome to Apna College and in this video we will be talking about Cloud Computing. If you use Gmail, Google Drive, Google Photos, Microsoft OneDrive or you watch movies on Netflix and Prime Video then you are already connected to Cloud Computing because all these services are based on Cloud Computing.","['Technology', 'pc hardware']"
https://www.youtube.com/watch?v=SSnNY8GfZig&pp=ygULcGMgaGFyZHdhcmU%3D, Types of hardware Computer hardware is the physical parts of the computer system. Computer hardware is divided into internal hardware and external hardware. Internal hardware Internal hardware are hardware found inside the system unit.,"['Technology', 'pc hardware']"
https://www.youtube.com/watch?v=wktwFaCA3Jg&pp=ygULcGMgaGFyZHdhcmU%3D," Hey guys, Metal Jesus here. Now you guys know that I love my big box PC games, but you may be surprised to learn that up until recently, I did not own a 90s MS-DOS gaming PC, until now. I've actually recently worked with a local Seattle company to help me build the ultimate 90s gaming PC, and in this video, we're gonna talk about the hardware that we chose, we're gonna talk about some of the software that we put on it, and of course, we gotta play some games. Let's take a look.","['Technology', 'pc hardware']"
https://www.youtube.com/watch?v=6seRR8EicTA&pp=ygULcGMgaGFyZHdhcmU%3D," Hey there guys and girls, my name is Snowy and this is a little tutorial about those people who want to play Cities Skylines for the first time and they do not know for sure what kind of hardware or computer they would need to actually play this game. Now, a little introduction into place, it's like this game has been released in 2015, so that's nearly eight years ago.","['Technology', 'pc hardware']"
https://www.youtube.com/watch?v=6Tzhs1D3E1A&pp=ygULcGMgaGFyZHdhcmU%3D," Hi Viewers, Today we will learn about Computer Motherboard","['Technology', 'pc hardware']"
https://www.youtube.com/watch?v=BXDfWekiLbE&pp=ygULcGMgaGFyZHdhcmU%3D," Hey guys, I sat down here today and we want to take a look at the Abloh A4 together. You may have already seen our video about the closed beta. It has changed a bit, mainly small things. The performance is a bit rounder and we'll just take a look at that here.","['Technology', 'pc hardware']"
https://www.youtube.com/watch?v=K_0txIvJuPM&pp=ygULcGMgaGFyZHdhcmU%3D," Assalamu alaikum friends, welcome to ITGurBaharBangla. Friends, the video that I have brought today is the first part of the basic training of the computer, the introduction of the hardware of the computer. So friends, at the beginning of the basic training of the computer, we need to know about the hardware very well. What is the work of which hardware? How does the hardware work?","['Technology', 'pc hardware']"
https://www.youtube.com/watch?v=nTtdEYRh8WI&pp=ygULcGMgaGFyZHdhcmU%3D," Welcome to another video from ExplainingComputers.com. This time, I'm going to explain the hardware inside a desktop PC.","['Technology', 'pc hardware']"
https://www.youtube.com/watch?v=Mdl1Y-77e84&pp=ygULcGMgaGFyZHdhcmU%3D," Hello friends, how are you? I hope you all are fine. In today's video, we are going to talk about when your laptop or PC button or system reboots and starts getting some errors like hardware, diagnostic, EWPS etc. In that condition, we are going to show you how to set up your system and how to fix it in today's video.","['Technology', 'pc hardware']"
https://www.youtube.com/watch?v=tC0pTx0zwsg&pp=ygULcGMgaGFyZHdhcmU%3D, Outro Music,"['Technology', 'pc hardware']"
https://www.youtube.com/watch?v=8L6QpnnevFY&pp=ygULcGMgaGFyZHdhcmU%3D," For those who don't know, I do YouTube full time right now. Well technically I'm still a college student and I also do YouTube work on the side, but I do a lot of other stuff to supplement my income because the YouTube channel isn't to the point yet where it can fully sustain all three of us. So what I do is flip PC hardware on the side where I buy PC hardware","['Technology', 'pc hardware']"
https://www.youtube.com/watch?v=Y4UBGVxwMt0&pp=ygULcGMgaGFyZHdhcmU%3D," Friends, if you use a computer, then you must have heard about the motherboard. But in this case, do you know what is a motherboard? What is the use of it? What is the use of the different components in the motherboard? And all the components installed in the motherboard, such as hard disk, pen drive, mouse, keyboard, CPU, RAM, where is all this installed in the motherboard? So basically, to know all this, you have to watch this video till the end.","['Technology', 'pc hardware']"
https://www.youtube.com/watch?v=x-zSLV2nweU&pp=ygULcGMgaGFyZHdhcmU%3D," I think we can all agree that this year has been a very challenging and interesting year in many contexts. But in the context of PC hardware, this has been a really interesting year with many big and important releases. Nvidia's new Ampere GPUs, for example, which we're still seeing releases from as the months go by and they work their way down the product stack.","['Technology', 'pc hardware']"
https://www.youtube.com/watch?v=iNw1vGyCPZs&pp=ygULcGMgaGFyZHdhcmU%3D," Hello the YouTubes, I'm your boy Dave. Your old boy Dave. Yeah, thanks. And I'm the man Jacob. Yes, and today we're going to look at the most invasive upgrade you can do with your PC. Replacing the motherboard.","['Technology', 'pc hardware']"
https://www.youtube.com/watch?v=1WosOJ8zQoc&pp=ygULcGMgaGFyZHdhcmU%3D," Welcome to my latest video, nice that you have switched on. I am the tech consultant from the beautiful Düsseldorf and I would like to show you today how we make a diagnosis on the computer with the help of a software. There is a software from the company Toolhouse with which you can diagnose the PC. What exactly happens and what is tested there, I'll show you after the intro.","['Technology', 'pc hardware']"
https://www.youtube.com/watch?v=N60H4JzgV64&pp=ygULcGMgaGFyZHdhcmU%3D," Hello friends, I welcome you once again in this new technical episode. In today's video, I will tell you how you can easily find out any hardware related problem in your PC. Means if you have any problem on your PC like your hard drive is not working properly or there is some problem in processor or your speaker is not working properly or there is some problem of this type then you can easily find out this problem by using these tricks. And you can also take action accordingly.","['Technology', 'pc hardware']"
https://www.youtube.com/watch?v=4_fMX5BwRKM&pp=ygULcGMgaGFyZHdhcmU%3D," Today, prices are continuing to fall for PC hardware, these AMD CPUs have a really weird bug, AMD just made Ryzen 8000 official, plus new desktop APUs and Ryzen 8000 performance here we come. Welcome everyone to GamerMelt!","['Technology', 'pc hardware']"
https://www.youtube.com/watch?v=7ARV7vyAlzk&pp=ygULcGMgaGFyZHdhcmU%3D, hello guys welcome to my youtube channel and you are watching d2 technical with Atul so guys today's video is going to be about HP Hardware diagnostics UEFI as you can see here it is showing some problem like this it is showing the problem this problem is basically related to hard drive which will be given to you now I will tell you 2-3 steps do it like this it will be solved like this 99% it will be solved so guys,"['Technology', 'pc hardware']"
https://www.youtube.com/watch?v=DdH76Iup_LU&pp=ygULcGMgaGFyZHdhcmU%3D," Hello everyone. Today, I will show you two ways to download and play our game, CPU, RAM, and","['Technology', 'pc hardware']"
https://www.youtube.com/watch?v=wZ-QVOKGVyM&pp=ygULcGMgaGFyZHdhcmU%3D," Dear Asus, it's been real, but it's over.","['Technology', 'pc hardware']"
https://www.youtube.com/watch?v=WgBMHlSIMTU&pp=ygULcGMgaGFyZHdhcmU%3D," What hardware do you need to play Starfield? You asked and we have some answers. Can it run on portables like the Steam Deck or the ROG Ally? How well does it run on the best from AMD, NVIDIA, and Intel? Will it run on a russet potato I found in my backyard? I don't know if that's a russet potato, but you know what? Let's find out.","['Technology', 'pc hardware']"
https://www.youtube.com/watch?v=opy_lvc6DQw&pp=ygULcGMgaGFyZHdhcmU%3D, Have you just built a new PC and not sure whether it's running optimally? In this video I'm going to show you a very quick way you can check that your hardware has been set up correctly so that you're getting the most out of your PC. Stay tuned.,"['Technology', 'pc hardware']"
https://www.youtube.com/watch?v=HNAKbljVI00&pp=ygULcGMgaGFyZHdhcmU%3D," Welcome viewer, I am Murugan S. This video tutorial describes, Fix sorry your PC doesn't meet the hardware requirements First method is type device manager in Windows search bar Click device manager Click and expand display adapters","['Technology', 'pc hardware']"
https://www.youtube.com/watch?v=9V9Z12u3lRU&pp=ygULcGMgaGFyZHdhcmU%3D," Hello, it's ConfigGaroba103 I'm going to show you the Hardware Diagnostics feature integrated to all PCHP released after 2012 So, at the start of your computer, you will tap the Escape button Then you will go down on System Diagnostics You will enter and there you will have two possible choices So a Memory Test and a Hard Drive Check So the Memory Test is to test your RAM cards","['Technology', 'pc hardware']"
https://www.youtube.com/watch?v=_l928dd288Q&pp=ygULcGMgaGFyZHdhcmU%3D, Vlad and Zeke learn the alphabet! A Animals! Run! B,"['Technology', 'pc hardware']"
https://www.youtube.com/watch?v=S6-5FCv7-_g&pp=ygULcGMgaGFyZHdhcmU%3D," Welcome to How to Build Your Own PC. This course has been designed to give you all the information and instruction you need to successfully build your own PC. By building it yourself, you will not only have a great new understanding of how computers work, but you will also easily save hundreds of dollars on the cost of your new computer. First, I will introduce you to the parts that make up your computer. Then we will build our own computer, step by step.","['Technology', 'pc hardware']"
https://www.youtube.com/watch?v=Ei3IuH8IZYI&pp=ygULcGMgaGFyZHdhcmU%3D," Good people, I hope you enjoyed today's video because over the past year or so I've been collecting these little knick-knacks, what I would call them. Not necessarily something that I use every day, but these are some cool PC components you probably never heard of that could potentially be useful for your next build.","['Technology', 'pc hardware']"
