url,text,tags
https://www.youtube.com/watch?v=j8HQYaXw_4w&pp=ygUNbGFwdG9wIHJldmlldw%3D%3D," Assalamu Alaikum Viewers, How are you all? I am also fine. Today I will review a laptop which will be a practical review and whose budget is around 70,000 rupees. That is, this laptop is becoming a base laptop for those who have a budget of 70,000 rupees plus or minus. So, stay with me for the whole video. I am Munir with you and you are watching Dhaka Info Channel.","['Technology', 'laptop review']"
https://www.youtube.com/watch?v=RIphIqHEdxY&pp=ygUNbGFwdG9wIHJldmlldw%3D%3D," The big boy 15-inch MacBook Air is finally here, and I would not be surprised if this ends up being Apple's best-selling laptop, because people have wanted this thing forever. Like, for years now, the only way to get a big screen on an Apple computer is to get the Pro devices. You gotta pay Pro money to get the Pro MacBooks, and it's frustrating, right? Like, for a lot of people, my wife, my mom, they were basically conned into buying those Pro devices just because they wanted the bigger screen. They had no use of, like, the extra capabilities of the Pro machines, they just want big screens.","['Technology', 'laptop review']"
https://www.youtube.com/watch?v=w8PTR9H1e9M&pp=ygUNbGFwdG9wIHJldmlldw%3D%3D," How many years have we been making videos on LG Grams? And to be honest, they've never done particularly well. The views just aren't really there for it, which is a shame because I've always been a fan of them, but they've just been very expensive and arguably a little bit boring. Yes, they've been super duper lightweight, but beyond that, nothing particularly interesting, just an ultrabook.","['Technology', 'laptop review']"
https://www.youtube.com/watch?v=w_61VE-YCrY&pp=ygUNbGFwdG9wIHJldmlldw%3D%3D," Look at this laptop. This laptop turns into a tablet in seconds. Is this laptop best for you? It will be fun to test this laptop. Let's test it together. It has a big thing in it. Nice nice. A box has come from the tail. You must have heard the name. Shopping days. Smart tech, big savings. And where there is tech, we are there. Shopping days by Technology Gyan.","['Technology', 'laptop review']"
https://www.youtube.com/watch?v=6ZJFciRzxBI&pp=ygUNbGFwdG9wIHJldmlldw%3D%3D," The ASUS ZenBook 14 and 14X are great laptops. And in this video, I'm not only going to show you why, but I'm also going to explain why the 14X in particular is a groundbreaking device. I know that's a bold statement, but I believe it is one of the most important laptops that has been released in the last several years. And yes, even Apple needs to be super concerned about this device.","['Technology', 'laptop review']"
https://www.youtube.com/watch?v=YHFt4-jvIl0&pp=ygUNbGFwdG9wIHJldmlldw%3D%3D," Whenever we talk about Lenovo's gaming laptops, there are two series. One is Lenovo's Legion series and the other is IdeaPad series. A few days ago we reviewed Lenovo Legion and this year we don't know about IdeaPad. Because IdeaPad came in 4000 series. Last generation came with 12th generation with 3000 series graphics card. But Lenovo said that we will show you something new. Lock?","['Technology', 'laptop review']"
https://www.youtube.com/watch?v=-nzaPSYrOOo&pp=ygUNbGFwdG9wIHJldmlldw%3D%3D," After a long time, Honor is back.","['Technology', 'laptop review']"
https://www.youtube.com/watch?v=tpoa6P1zB5E&pp=ygUNbGFwdG9wIHJldmlldw%3D%3D," Hi guys, this is Ranjeet and in this video, let's review this MacBook Air N1. And guys, if you recall, I took my time, I purchased this on January 11th. If I recall, I posted the initial video on January 12th. Now it's February 15th and I've been actually using this one for the past one month. And in fact, most of the videos that you see on my channel are actually edited via this one. And I'll say the summary right now.","['Technology', 'laptop review']"
https://www.youtube.com/watch?v=VxySeDsTCxQ&pp=ygUNbGFwdG9wIHJldmlldw%3D%3D," A hot laptop has just been listed on Amazon with Acer Nitro 5 i7 12th generation and RTX 3070 Ti for just Rs 1,10,000. And my comment section is done.","['Technology', 'laptop review']"
https://www.youtube.com/watch?v=Gd5hIIb8_XI&pp=ygUNbGFwdG9wIHJldmlldw%3D%3D," This is the new Surface Laptop 5 that just recently started shipping. It's a laptop designed by Microsoft, my previous employer. I guess we parted on good terms because they were willing to send this free loaner unit to me. We're going to look at, is this laptop any good, and should you consider getting it?","['Technology', 'laptop review']"
https://www.youtube.com/watch?v=yWizwQDRXm0&pp=ygUNbGFwdG9wIHJldmlldw%3D%3D," Last week, Walton told us that they have released a laptop which is unbeatable in the 40K price range. Walton and unbeatable. We said, okay fine. We will send it to our studio and see what happens. Today we will talk about the Walton Prelude N50. We will try to see how the laptop performs in 43K. I am Anand Najaman and you are watching PC Builder Bangladesh.","['Technology', 'laptop review']"
https://www.youtube.com/watch?v=bHGJFk5Yw2k&pp=ygUNbGFwdG9wIHJldmlldw%3D%3D, Welcome to a back to school laptop video. I hate doing this video not because of what you think but because it reminds me that summer is pretty much almost over. In one month August will be done and everybody's going back to school. On top of that the weather here in Canada starts to get colder and colder into the winter and it drives me crazy. But the good news this year is that there's a lot of amazing deals happening right now,"['Technology', 'laptop review']"
https://www.youtube.com/watch?v=T_RGUYTFyk4&pp=ygUNbGFwdG9wIHJldmlldw%3D%3D," In this video, I'm going to show you how to use a laptop to test a sensor. I'm going to show you how to use a laptop to test a sensor. I'm going to show you how to use a laptop to test a sensor. I'm going to show you how to use a laptop to test a sensor. I'm going to show you how to use a laptop to test a sensor. I'm going to show you how to use a laptop to test a sensor. I'm going to show you how to use a laptop to test a sensor. I'm going to show you how to use a laptop to test a sensor. I'm going to show you how to use a laptop to test a sensor. I'm going to show you how to use a laptop to test a sensor. I'm going to show you how to use a laptop to test a sensor. I'm going to show you how to use a laptop to test a sensor. I'm going to show you how to use a laptop to test a sensor. I'm going to show you how to use a laptop to","['Technology', 'laptop review']"
https://www.youtube.com/watch?v=Cz1otFOjJwM&pp=ygUNbGFwdG9wIHJldmlldw%3D%3D," This is the brand new Asus ZenBook S13 OLED. I'm not going to say thin-credible. That was in Asus' marketing materials. I'm not saying it. But it is pretty thin and light. Now, last year's ZenBook S13 OLED was really popular. Loads of you guys watched that video. And this is, well, it's a bit different. They've prioritized portability and sustainability over performance.","['Technology', 'laptop review']"
https://www.youtube.com/watch?v=pxiP-HJLCx0&pp=ygUNbGFwdG9wIHJldmlldw%3D%3D," In this video, I'm going to tell you the best laptops for students. Now, for this one, my team and I went absolutely nuts. We got in pretty much every viable student laptop. Think I'm joking? I am not. We tested an epic 15 laptops. Everything from Apple's MacBook Air to Microsoft Surface Laptop, from Asus' Zenbooks to Samsung Galaxy Books. You name it, we tested it.","['Technology', 'laptop review']"
https://www.youtube.com/watch?v=HYzvMSXOCDA&pp=ygUNbGFwdG9wIHJldmlldw%3D%3D," Okay, so today we have a gaming laptop, the HP Victus with an AMD GPU and AMD CPU. And we recently featured this laptop on the Mac vs Windows video where a lot of you guys asked for a review. Okay, so you ask, we deliver faster than Swiggy and Blinkit.","['Technology', 'laptop review']"
https://www.youtube.com/watch?v=4imnaQhpotI&pp=ygUNbGFwdG9wIHJldmlldw%3D%3D," Hi everyone, I'm Mark and this is probably the best laptop for the office. It's super portable, has plenty of ports, good battery life, and is very durable. This is the Lenovo ThinkPad X1 Carbon Gen 11. For disclosure, this laptop was provided by Lenovo for review. When I'm finished with the review, it goes back to Lenovo.","['Technology', 'laptop review']"
https://www.youtube.com/watch?v=Y0tYtatquj8&pp=ygUNbGFwdG9wIHJldmlldw%3D%3D," Always remember one thing, the price of your laptop, your family background, your bank balance as a student, it doesn't matter how big you are going to be in your college in 4 years.","['Technology', 'laptop review']"
https://www.youtube.com/watch?v=0rkTgPt3M4k&pp=ygUNbGFwdG9wIHJldmlldw%3D%3D," It is simply not possible to build a device that is both elegant and repairable. Look at this beautiful MacBook. Your idiot hands couldn't repair it. If it was easy to repair, it would be some thick, flimsy, 2010-looking piece of crap. Actually, no. Those excuses no longer hold any water. The team over at Framework","['Technology', 'laptop review']"
https://www.youtube.com/watch?v=4Q3LDx1sR-w&pp=ygUNbGFwdG9wIHJldmlldw%3D%3D," Tech family, I recently sought to upgrade my own laptop, my MacBook Pro 14 with M1, to one of the new ones with M2. As a laptop reviewer, I do own several laptops which I enjoy using. However, the MacBook Pro 14 has without a doubt been my most used laptop since it came out. It has come with me all around the world, from India to Colombia to Australia.","['Technology', 'laptop review']"
https://www.youtube.com/watch?v=ptywF5plplc&pp=ygUNbGFwdG9wIHJldmlldw%3D%3D," This is Lisa from Mobile Tech Review, and this is the HP Dragonfly G4. G4 means fourth generation, which is an evolutionary improvement over the G3. No surprise there, right? So it's in this fetching slate blue cover.","['Technology', 'laptop review']"
https://www.youtube.com/watch?v=P6I-bB5KXyU&pp=ygUNbGFwdG9wIHJldmlldw%3D%3D," In this box, we have HP's new laptop. For those who don't know, HP comes in two series. One is for gaming. One is for college, DJI, etc. The other one is for love. I've mixed both of them. This is HP's Pavilion series laptop. It has some gaming features as well. Let's not get carried away. We'll make this laptop do a 6K video edit at the end. I'm ready to open it.","['Technology', 'laptop review']"
https://www.youtube.com/watch?v=UXM_tnAR8WM&pp=ygUNbGFwdG9wIHJldmlldw%3D%3D," The best budget laptops are good enough for basic work and play. They don't cost an arm and a leg, but they also don't feel cheap, offering decent performance, easy to read screens and battery life that's good enough. They aren't all stodgy, grey, clamshell laptops either. Many of the best laptops under $500 are Chromebooks or tablets with detachable keyboards. And if you're willing to spend a bit more, you can get an affordable premium Windows 11 laptop from the likes of Acer or Asus.","['Technology', 'laptop review']"
https://www.youtube.com/watch?v=Oa4AmOyDauo&pp=ygUNbGFwdG9wIHJldmlldw%3D%3D," Oh, there are too many options. Hey, what's up guys? Pratima here. So, if you're a student or a fresher looking for a reliable daily driver laptop on a budget, one of my first recommendations have always been the Aspire series lineup from Acer as they always offer balanced specs at a budget-friendly price. And today, I have the new Acer Aspire 5 2023 edition with me.","['Technology', 'laptop review']"
https://www.youtube.com/watch?v=3U0Dicp4qy4&pp=ygUNbGFwdG9wIHJldmlldw%3D%3D," How's it going, guys? Jack Madder with the Toasty Bros, and today we're going to be talking about the few laptops in 2022 going into 2023 that we really like in the $400 to a little over $1,000 price range. And these laptops are not it. Once again, we got some props on the table today as we're going to talk to you about our favorite laptops that we reviewed here on the channel. And as Jackson mentioned, we're going to go really, really budget and then go to somewhere you would say is probably like mid-range to high-end.","['Technology', 'laptop review']"
https://www.youtube.com/watch?v=ACo0vaf2DE0&pp=ygUNbGFwdG9wIHJldmlldw%3D%3D," In this video, I'm going to compare the most common budget laptops available and pick a winner. You all know them, Dell's Inspirons, HP's Pavilions and Lenovo's IdeaPads. And yes, there are definitely more budget laptops available, but I wanted to keep this video to the major contenders that are available everywhere.","['Technology', 'laptop review']"
https://www.youtube.com/watch?v=pWEGRDvo4uc&pp=ygUNbGFwdG9wIHJldmlldw%3D%3D," Assalam o Alaikum everyone this is Bilal from Bidwali Sarkar and on this channel I have started to show you Honor's mobile phones and I have told you that Honor is finally coming back to Pakistan but here I would like to make it clear that Honor is not just a mobile phone brand, in fact this thing is very important","['Technology', 'laptop review']"
https://www.youtube.com/watch?v=jNbIOKV1PVA&pp=ygUNbGFwdG9wIHJldmlldw%3D%3D," Hello gorgeous peeps, I'm Chris from TechSpurt and today we're going to be checking out Lenovo's Yoga Pro 9i, an ultra-portable laptop that boasts some seriously beefy performance despite its slimline design. You've got a gorgeous PureSight Pro display with up to 3K resolution on this A14-inch model, 3.2K on the 16-incher, beefy speakers and the option of slapping in the latest 13th-gen Intel processor and Nvidia's GeForce RTX 4070 GPU for some ridiculous","['Technology', 'laptop review']"
https://www.youtube.com/watch?v=XZNfxtAc_1M&pp=ygUNbGFwdG9wIHJldmlldw%3D%3D," If you're a student, working professional or a gamer & you want a good laptop for regular long usage, then this video is for you! I'll show you 6 different laptops.","['Technology', 'laptop review']"
https://www.youtube.com/watch?v=pMcQpTPHmjE&pp=ygUNbGFwdG9wIHJldmlldw%3D%3D," Best Laptop under Rs. 45,000 In budget of Rs. 45,000, you get many processors like i3 12th gen, i5 11th gen, Ryzen 5000 series, some UP and H series processors but most of them are a wastage of money. So in today's video, I have covered the best processors, i3 12th gen 1220p processor,","['Technology', 'laptop review']"
https://www.youtube.com/watch?v=fNYZkqIn8rg&pp=ygUNbGFwdG9wIHJldmlldw%3D%3D," The Framework laptop is one of the most innovative laptops released in years, and I've been daily driving it for the past six months. This is my long-term review, and I'm going to break protocol by giving you my conclusion first, which is the Framework isn't the best laptop currently made by any company, but Framework is the best company currently making laptops. Let's dive into that.","['Technology', 'laptop review']"
https://www.youtube.com/watch?v=KFIr7eRsZMA&pp=ygUNbGFwdG9wIHJldmlldw%3D%3D," I've now had my hands on the latest and greatest Dell XPS 15 featuring the 13th generation Intel i9 processor and it's time to give you all my report on things that I've liked and the things that I've unfortunately not liked as much. First off, let's baseline everybody and go over the specs and ordering options that I purchased. Yes,","['Technology', 'laptop review']"
https://www.youtube.com/watch?v=E04uAwGoXPQ&pp=ygUNbGFwdG9wIHJldmlldw%3D%3D," Friends, this is our studio's most powerful laptop which we've made till now. It's a Windows laptop! But this one is crazy! The performance it gives is close to the desktop level! This is Asus' Strix Scar. The name is a bit complex but the laptop isn't! We're going to do its unboxing & first impressions. Watch it carefully till the end! This laptop has some very interesting things! Let's quickly open the box.","['Technology', 'laptop review']"
https://www.youtube.com/watch?v=FwxLjZObQ-8&pp=ygUNbGFwdG9wIHJldmlldw%3D%3D, I have a new laptop with me. This laptop is not too expensive or too cheap. It's just a little medium. So that's why this particular laptop is called Lenovo IdeaPad Slim 5i. What's in this? What's in this?,"['Technology', 'laptop review']"
https://www.youtube.com/watch?v=SdCULeO15NY&pp=ygUNbGFwdG9wIHJldmlldw%3D%3D," So it's been a minute since my last video, and in all fairness, I was on vacation for about the last two weeks. But we are back with one of the most popular mid-range productivity laptops. I'm talking about the latest iteration of the Lenovo IdeaPad 3i 2022 edition.","['Technology', 'laptop review']"
https://www.youtube.com/watch?v=MUunJrbMXP0&pp=ygUNbGFwdG9wIHJldmlldw%3D%3D," So right in front of me, I have a brand new product from Acer. It's a beautiful laptop. In fact, it's probably the most beautiful Acer product I've reviewed this year. It's called the Swift Edge. It's a 16-inch thin and light notebook. It's 2.54 pounds, which makes it a lighter laptop than the LG Gram, which I just reviewed a week ago. And it's on the same level as the Galaxy Book in terms of thinness. In fact, I actually prefer the look of this over the LG Gram. It's just like a simple black color with the Acer logo at the top.","['Technology', 'laptop review']"
https://www.youtube.com/watch?v=ngkvRnZF1pQ&pp=ygUNbGFwdG9wIHJldmlldw%3D%3D," As a part of Asus' OLED laptop range, the VivoBook Pro 14 OLED stands out as a well-rounded machine perfect for creating and even light gaming on the go. It aptly features a 2.8K resolution OLED screen coupled with an AMD Ryzen 5 CPU that utilizes its integrated Radeon graphics to power each task you throw at it. Hello and welcome to Box, where we unbox, review and demonstrate the latest tech.","['Technology', 'laptop review']"
https://www.youtube.com/watch?v=aQA01ahhZmI&pp=ygUNbGFwdG9wIHJldmlldw%3D%3D," Now, it is Mani Thirunelvelumukum Vanakkam! So, a lot of things are happening for Diwali. We have received another super honor box from Dell. It says, celebrate every festival with Dell. It says, Tamil Tech's festival. So, this is another gift. Let's see what's inside. But before that...","['Technology', 'laptop review']"
https://www.youtube.com/watch?v=jE4uVN3GJ4U&pp=ygUNbGFwdG9wIHJldmlldw%3D%3D," This is Apple's new 15-inch MacBook Air, and it may be the best MacBook ever made, but does that mean that it's right for you? Well, I've spent a month using this laptop, testing its larger form factor, its performance, and its battery life to find out not only if you should choose it over the smaller MacBook Air, but also, is that larger display good enough to have you skipping an upgraded MacBook Pro? And did I do this walking shot all in one take? Well,","['Technology', 'laptop review']"
https://www.youtube.com/watch?v=xstddPNi9B0&pp=ygUNbGFwdG9wIHJldmlldw%3D%3D, We took this unboxing a week and a half ago. We've been using this computer since then. The first thing that comes to my mind when I think of talking about this since then is...,"['Technology', 'laptop review']"
https://www.youtube.com/watch?v=sUUSmuClr7c&pp=ygUNbGFwdG9wIHJldmlldw%3D%3D," Assalamu Alaikum Viewers, How are you all? I am good. Today, I will show you the best laptop from 1 to 5. If you buy from these laptops, the price has gone up a lot. These laptops are still the best laptops in the market. Those who do CSE student engineering or work in graphics design outsourcing.","['Technology', 'laptop review']"
https://www.youtube.com/watch?v=rK_VqIvYABs&pp=ygUNbGFwdG9wIHJldmlldw%3D%3D," Welcome to Chai with Tech. Don't worry, it's not Chai with Tech. A lot of people have asked me to suggest laptops under 60,000. So, while I was buying this laptop, I did a lot of research, did, did, did, did, did, did, did, did, did, did, did, did, did, did, did, did, did, did, did, did, did, did, did, did, did, did, did, did, did, did, did, did, did, did, did, did, did, did, did, did, did, did, did, did, did, did, did, did, did, did, did, did, did, did, did, did, did, did, did, did, did, did, did, did, did, did, did, did, did, did, did, did, did, did, did, did, did, did, did, did, did, did, did, did, did, did, did,","['Technology', 'laptop review']"
https://www.youtube.com/watch?v=jIFqzUi-aNo&pp=ygUNbGFwdG9wIHJldmlldw%3D%3D," Hi guys, good morning, good afternoon, good evening. My name is Dustin from Laptop Factory. So guys, congratulations to Renz, JC, and John. They won the Aorus T-shirt. This is actually XL size. Currently, we are already at 48,000 subscribers. So we're almost there. And we'll give away a laptop when we reach 50,000 subscribers.","['Technology', 'laptop review']"
https://www.youtube.com/watch?v=2hqSWJ9Qvxw&pp=ygUNbGFwdG9wIHJldmlldw%3D%3D," MSI's GF63 is the cheapest gaming laptop you can currently buy right now for around $500 USD, but as with most things in life, you get what you pay for, so let's find out what compromises have been made in this review. The GF63 has an all black design with a brushed aluminum lid and interior. I was surprised that it's not all plastic, but make no mistake, with the way it feels it might as well be.","['Technology', 'laptop review']"
https://www.youtube.com/watch?v=3I92bjr20pg&pp=ygUNbGFwdG9wIHJldmlldw%3D%3D," Welcome back to Thistle Photo's YouTube channel. Today I'm here to talk about the new VivoBook Pro 15 OLED laptop from Asus, which is made for creators and gamers like us. This laptop is actually a very beautiful laptop. So let's first see what you get when you buy this laptop and what is my unboxing experience. So, without further ado, let's go.","['Technology', 'laptop review']"
https://www.youtube.com/watch?v=3i0HG5kdAno&pp=ygUNbGFwdG9wIHJldmlldw%3D%3D," This is the best laptop deal right now for students and this actually converts a bad laptop into a really good value for money option. So this is a laptop that launched in India last year in September at Rs 56,990 but right now this is available for Rs 32,990 in fact it even goes lower to 29,999 and I'm not even kidding.","['Technology', 'laptop review']"
https://www.youtube.com/watch?v=hp9ykdmwH4w&pp=ygUNbGFwdG9wIHJldmlldw%3D%3D, Okay.,"['Technology', 'laptop review']"
https://www.youtube.com/watch?v=y19KGK900rg&pp=ygUNbGFwdG9wIHJldmlldw%3D%3D," Hi friends, this is Nazeer and you are watching TechReport channel. Friends, today we are going to unbox the Asus VivoBook 15 from Asus. We have recently unboxed this laptop. We are going to consider the performance wise, battery backup, everything and decide whether we should purchase it or not. I will give you a clear clarity in this video. Watch the video till the end. Then only you will get a clear clarity. If you haven't watched the Asus VivoBook 15 unboxing video yet, definitely watch it.","['Technology', 'laptop review']"
https://www.youtube.com/watch?v=czGk-tR31AE&pp=ygUNbGFwdG9wIHJldmlldw%3D%3D," Alright tech family, I've now done a good amount of testing on Apple's new M2 laptops, as well as Intel's 13th gen processors for PC laptops with Windows. And I've even started testing AMD Ryzen 7000 series processors, although unfortunately their newer Zen 4 ones have been delayed so I haven't tested them yet.","['Technology', 'laptop review']"
https://www.youtube.com/watch?v=ag8gw1DxMao&pp=ygUNbGFwdG9wIHJldmlldw%3D%3D," Hello everyone, so today I am going to talk about the best budget laptops that you can buy right now. These are the best options if you are a college student or someone who needs a laptop for all your office work. So for this guide, I am not including laptops with newer 13th Gen or Ryzen 7000 series processors as they are quite expensive right now. But don't worry, last-gen Intel and AMD CPUs still pack a punch and are more than capable of handling your everyday tasks.","['Technology', 'laptop review']"
https://www.youtube.com/watch?v=bgfq6wWsoCc&pp=ygUNbGFwdG9wIHJldmlldw%3D%3D," Thanks to Lenovo and Intel for sponsoring this video. Stick around to the end for details on how you can win your very own Legion gaming setup worth over $3,000. As someone who's always been interested in gaming laptops, the overly gamer aesthetic that they typically have has always sort of turned me off.","['Technology', 'laptop review']"
https://www.youtube.com/watch?v=3Oq_lVxCcYI&pp=ygUNbGFwdG9wIHJldmlldw%3D%3D," This is MSI's new Vector GP77 gaming laptop. The GP series is a step down from their higher tier but more expensive GE series, so there's no RGB unicorn spew and it's missing some other nice to have features. It instead focuses on what makes a good core gaming experience, without having to spend more money on the extra bells and whistles.","['Technology', 'laptop review']"
https://www.youtube.com/watch?v=gte9C4TgFRY&pp=ygUNbGFwdG9wIHJldmlldw%3D%3D," I have this laptop with me. You can find many laptops like this in the market. And among these many laptops, it is almost impossible to find the right laptop for you. Today, I will talk about this laptop. Along with that, I will tell you how much this laptop will cost. You can see that it is a very clean, clean, silver colored laptop. And the laptop is very big. This laptop","['Technology', 'laptop review']"
https://www.youtube.com/watch?v=d2ru3DcK7Wc&pp=ygUNbGFwdG9wIHJldmlldw%3D%3D, So this is the brand new Asus OC Dual RTX 4060 is retailing for $299 which is the exact same price as the RTX 2060 and 3060 when it first launched many many years ago. Whether it remains at $299 is a totally different story. Usually launch price is always lower than retail and based on the prices of previous generation cards I highly doubt it's going to stay at $299. It's probably going to be a bit more expensive.,"['Technology', 'laptop review']"
https://www.youtube.com/watch?v=TSikuFD8M3Q&pp=ygUNbGFwdG9wIHJldmlldw%3D%3D, Apple completely shocked the tech industry back in 2020 with the release of their new M1 MacBook Air which instantly became the best value laptop you could buy thanks to its $1000 price tag and the game-changing M1 chip which is still very powerful to this day.,"['Technology', 'laptop review']"
